{
  "format": "sditadc-map",
  "version": 1,
  "name": "标准仓库",
  "grid": {
    "width": 32,
    "height": 24,
    "rows": [
      "################################",
      "#..............................#",
      "#..............................#",
      "#..............................#",
      "#..............................#",
      "#...RRR..RRR..RRR..RRR..RRR....#",
      "#...RRR..RRR..RRR..RRR..RRR....#",
      "#..............................#",
      "#..............................#",
      "#...RRR..RRR..RRR..RRR..RRR....#",
      "#...RRR..RRR..RRR..RRR..RRR....#",
      "#..............................#",
      "#..............................#",
      "#...RRR..RRR..RRR..RRR..RRR....#",
      "#...RRR..RRR..RRR..RRR..RRR....#",
      "#..............................#",
      "#..............................#",
      "#...RRR..RRR..RRR..RRR..RRR....#",
      "#...RRR..RRR..RRR..RRR..RRR....#",
      "#..............................#",
      "#..............................#",
      "#..............................#",
      "#..............................#",
      "################################"
    ]
  },
  "points": {
    "starts": [
      [
        2,
        2
      ],
      [
        3,
        2
      ],
      [
        4,
        2
      ],
      [
        5,
        2
      ],
      [
        6,
        2
      ],
      [
        7,
        2
      ]
    ],
    "parking": [
      [
        2,
        2
      ],
      [
        3,
        2
      ],
      [
        4,
        2
      ],
      [
        5,
        2
      ],
      [
        6,
        2
      ],
      [
        7,
        2
      ],
      [
        29,
        2
      ],
      [
        2,
        21
      ],
      [
        29,
        21
      ]
    ],
    "pickups": [
      [
        5,
        4
      ],
      [
        10,
        4
      ],
      [
        15,
        4
      ],
      [
        20,
        4
      ],
      [
        25,
        4
      ],
      [
        5,
        8
      ],
      [
        10,
        8
      ],
      [
        15,
        8
      ],
      [
        20,
        8
      ],
      [
        25,
        8
      ],
      [
        5,
        12
      ],
      [
        10,
        12
      ],
      [
        15,
        12
      ],
      [
        20,
        12
      ],
      [
        25,
        12
      ],
      [
        5,
        16
      ],
      [
        10,
        16
      ],
      [
        15,
        16
      ],
      [
        20,
        16
      ],
      [
        25,
        16
      ]
    ],
    "deliveries": [
      [
        9,
        21
      ],
      [
        15,
        21
      ],
      [
        21,
        21
      ],
      [
        26,
        21
      ]
    ]
  },
  "random_obstacles": {
    "count": 20,
    "region": [
      2,
      3,
      30,
      21
    ]
  },
  "robots": {
    "default_count": 3,
    "max_count": 6
  },
  "locations": {
    "shelves": [
      {
        "id": "S01",
        "name": "1号货架",
        "aliases": [],
        "pickup_id": "P01",
        "cells": [
          [
            4,
            5
          ],
          [
            5,
            5
          ],
          [
            6,
            5
          ],
          [
            4,
            6
          ],
          [
            5,
            6
          ],
          [
            6,
            6
          ]
        ]
      },
      {
        "id": "S02",
        "name": "2号货架",
        "aliases": [],
        "pickup_id": "P02",
        "cells": [
          [
            9,
            5
          ],
          [
            10,
            5
          ],
          [
            11,
            5
          ],
          [
            9,
            6
          ],
          [
            10,
            6
          ],
          [
            11,
            6
          ]
        ]
      },
      {
        "id": "S03",
        "name": "3号货架",
        "aliases": [],
        "pickup_id": "P03",
        "cells": [
          [
            14,
            5
          ],
          [
            15,
            5
          ],
          [
            16,
            5
          ],
          [
            14,
            6
          ],
          [
            15,
            6
          ],
          [
            16,
            6
          ]
        ]
      },
      {
        "id": "S04",
        "name": "4号货架",
        "aliases": [],
        "pickup_id": "P04",
        "cells": [
          [
            19,
            5
          ],
          [
            20,
            5
          ],
          [
            21,
            5
          ],
          [
            19,
            6
          ],
          [
            20,
            6
          ],
          [
            21,
            6
          ]
        ]
      },
      {
        "id": "S05",
        "name": "5号货架",
        "aliases": [],
        "pickup_id": "P05",
        "cells": [
          [
            24,
            5
          ],
          [
            25,
            5
          ],
          [
            26,
            5
          ],
          [
            24,
            6
          ],
          [
            25,
            6
          ],
          [
            26,
            6
          ]
        ]
      },
      {
        "id": "S06",
        "name": "6号货架",
        "aliases": [],
        "pickup_id": "P06",
        "cells": [
          [
            4,
            9
          ],
          [
            5,
            9
          ],
          [
            6,
            9
          ],
          [
            4,
            10
          ],
          [
            5,
            10
          ],
          [
            6,
            10
          ]
        ]
      },
      {
        "id": "S07",
        "name": "7号货架",
        "aliases": [],
        "pickup_id": "P07",
        "cells": [
          [
            9,
            9
          ],
          [
            10,
            9
          ],
          [
            11,
            9
          ],
          [
            9,
            10
          ],
          [
            10,
            10
          ],
          [
            11,
            10
          ]
        ]
      },
      {
        "id": "S08",
        "name": "8号货架",
        "aliases": [],
        "pickup_id": "P08",
        "cells": [
          [
            14,
            9
          ],
          [
            15,
            9
          ],
          [
            16,
            9
          ],
          [
            14,
            10
          ],
          [
            15,
            10
          ],
          [
            16,
            10
          ]
        ]
      },
      {
        "id": "S09",
        "name": "9号货架",
        "aliases": [],
        "pickup_id": "P09",
        "cells": [
          [
            19,
            9
          ],
          [
            20,
            9
          ],
          [
            21,
            9
          ],
          [
            19,
            10
          ],
          [
            20,
            10
          ],
          [
            21,
            10
          ]
        ]
      },
      {
        "id": "S10",
        "name": "10号货架",
        "aliases": [],
        "pickup_id": "P10",
        "cells": [
          [
            24,
            9
          ],
          [
            25,
            9
          ],
          [
            26,
            9
          ],
          [
            24,
            10
          ],
          [
            25,
            10
          ],
          [
            26,
            10
          ]
        ]
      },
      {
        "id": "S11",
        "name": "11号货架",
        "aliases": [],
        "pickup_id": "P11",
        "cells": [
          [
            4,
            13
          ],
          [
            5,
            13
          ],
          [
            6,
            13
          ],
          [
            4,
            14
          ],
          [
            5,
            14
          ],
          [
            6,
            14
          ]
        ]
      },
      {
        "id": "S12",
        "name": "12号货架",
        "aliases": [],
        "pickup_id": "P12",
        "cells": [
          [
            9,
            13
          ],
          [
            10,
            13
          ],
          [
            11,
            13
          ],
          [
            9,
            14
          ],
          [
            10,
            14
          ],
          [
            11,
            14
          ]
        ]
      },
      {
        "id": "S13",
        "name": "13号货架",
        "aliases": [],
        "pickup_id": "P13",
        "cells": [
          [
            14,
            13
          ],
          [
            15,
            13
          ],
          [
            16,
            13
          ],
          [
            14,
            14
          ],
          [
            15,
            14
          ],
          [
            16,
            14
          ]
        ]
      },
      {
        "id": "S14",
        "name": "14号货架",
        "aliases": [],
        "pickup_id": "P14",
        "cells": [
          [
            19,
            13
          ],
          [
            20,
            13
          ],
          [
            21,
            13
          ],
          [
            19,
            14
          ],
          [
            20,
            14
          ],
          [
            21,
            14
          ]
        ]
      },
      {
        "id": "S15",
        "name": "15号货架",
        "aliases": [],
        "pickup_id": "P15",
        "cells": [
          [
            24,
            13
          ],
          [
            25,
            13
          ],
          [
            26,
            13
          ],
          [
            24,
            14
          ],
          [
            25,
            14
          ],